No.     Time           Source                Destination           Protocol Length Info
     49 14.685093      192.168.4.2           192.168.4.1           TELNET   72     18 bytes data

Frame 49: 72 bytes on wire (576 bits), 72 bytes captured (576 bits)
Ethernet II, Src: Intel_c0:00:30 (f4:26:79:c0:00:30), Dst: c6:d8:d5:03:40:70 (c6:d8:d5:03:40:70)
    Destination: c6:d8:d5:03:40:70 (c6:d8:d5:03:40:70)
        .... ..1. .... .... .... .... = LG bit: Locally administered address (this is NOT the factory default)
        .... ...0 .... .... .... .... = IG bit: Individual address (unicast)
    Source: Intel_c0:00:30 (f4:26:79:c0:00:30)
        .... ..0. .... .... .... .... = LG bit: Globally unique address (factory default)
        .... ...0 .... .... .... .... = IG bit: Individual address (unicast)
    Type: IPv4 (0x0800)
    [Stream index: 0]
Internet Protocol Version 4, Src: 192.168.4.2, Dst: 192.168.4.1
Transmission Control Protocol, Src Port: 20075, Dst Port: 23, Seq: 1, Ack: 1, Len: 18
    Source Port: 20075
    Destination Port: 23
    [Stream index: 0]
    [Stream Packet Number: 4]
    [Conversation completeness: Incomplete, DATA (15)]
    [TCP Segment Len: 18]
    Sequence Number: 1    (relative sequence number)
    Sequence Number (raw): 2008890298
    [Next Sequence Number: 19    (relative sequence number)]
    Acknowledgment Number: 1    (relative ack number)
    Acknowledgment number (raw): 7691
    0101 .... = Header Length: 20 bytes (5)
    Flags: 0x018 (PSH, ACK)
    Window: 2048
    [Calculated window size: 2048]
    [Window size scaling factor: -2 (no window scaling used)]
    Checksum: 0x0c57 [unverified]
    [Checksum Status: Unverified]
    Urgent Pointer: 0
    [Timestamps]
    [SEQ/ACK analysis]
    TCP payload (18 bytes)
Telnet
    Data: [000000000000IDC1]

No.     Time           Source                Destination           Protocol Length Info
     50 14.715935      192.168.4.1           192.168.4.2           TELNET   72     18 bytes data

Frame 50: 72 bytes on wire (576 bits), 72 bytes captured (576 bits)
Ethernet II, Src: c6:d8:d5:03:40:70 (c6:d8:d5:03:40:70), Dst: Intel_c0:00:30 (f4:26:79:c0:00:30)
    Destination: Intel_c0:00:30 (f4:26:79:c0:00:30)
        .... ..0. .... .... .... .... = LG bit: Globally unique address (factory default)
        .... ...0 .... .... .... .... = IG bit: Individual address (unicast)
    Source: c6:d8:d5:03:40:70 (c6:d8:d5:03:40:70)
        .... ..1. .... .... .... .... = LG bit: Locally administered address (this is NOT the factory default)
        .... ...0 .... .... .... .... = IG bit: Individual address (unicast)
    Type: IPv4 (0x0800)
    [Stream index: 0]
Internet Protocol Version 4, Src: 192.168.4.1, Dst: 192.168.4.2
Transmission Control Protocol, Src Port: 23, Dst Port: 20075, Seq: 1, Ack: 19, Len: 18
    Source Port: 23
    Destination Port: 20075
    [Stream index: 0]
    [Stream Packet Number: 5]
    [Conversation completeness: Incomplete, DATA (15)]
    [TCP Segment Len: 18]
    Sequence Number: 1    (relative sequence number)
    Sequence Number (raw): 7691
    [Next Sequence Number: 19    (relative sequence number)]
    Acknowledgment Number: 19    (relative ack number)
    Acknowledgment number (raw): 2008890316
    0101 .... = Header Length: 20 bytes (5)
    Flags: 0x018 (PSH, ACK)
    Window: 2126
    [Calculated window size: 2126]
    [Window size scaling factor: -2 (no window scaling used)]
    Checksum: 0xe0f3 [unverified]
    [Checksum Status: Unverified]
    Urgent Pointer: 0
    [Timestamps]
    [SEQ/ACK analysis]
    TCP payload (18 bytes)
Telnet
    Data: [00000EA64815ID04]

No.     Time           Source                Destination           Protocol Length Info
     52 14.789448      192.168.4.2           192.168.4.1           TELNET   72     18 bytes data

Frame 52: 72 bytes on wire (576 bits), 72 bytes captured (576 bits)
Ethernet II, Src: Intel_c0:00:30 (f4:26:79:c0:00:30), Dst: c6:d8:d5:03:40:70 (c6:d8:d5:03:40:70)
    Destination: c6:d8:d5:03:40:70 (c6:d8:d5:03:40:70)
        .... ..1. .... .... .... .... = LG bit: Locally administered address (this is NOT the factory default)
        .... ...0 .... .... .... .... = IG bit: Individual address (unicast)
    Source: Intel_c0:00:30 (f4:26:79:c0:00:30)
        .... ..0. .... .... .... .... = LG bit: Globally unique address (factory default)
        .... ...0 .... .... .... .... = IG bit: Individual address (unicast)
    Type: IPv4 (0x0800)
    [Stream index: 0]
Internet Protocol Version 4, Src: 192.168.4.2, Dst: 192.168.4.1
Transmission Control Protocol, Src Port: 20075, Dst Port: 23, Seq: 19, Ack: 19, Len: 18
    Source Port: 20075
    Destination Port: 23
    [Stream index: 0]
    [Stream Packet Number: 7]
    [Conversation completeness: Incomplete, DATA (15)]
    [TCP Segment Len: 18]
    Sequence Number: 19    (relative sequence number)
    Sequence Number (raw): 2008890316
    [Next Sequence Number: 37    (relative sequence number)]
    Acknowledgment Number: 19    (relative ack number)
    Acknowledgment number (raw): 7709
    0101 .... = Header Length: 20 bytes (5)
    Flags: 0x018 (PSH, ACK)
    Window: 2030
    [Calculated window size: 2030]
    [Window size scaling factor: -2 (no window scaling used)]
    Checksum: 0xca32 [unverified]
    [Checksum Status: Unverified]
    Urgent Pointer: 0
    [Timestamps]
    [SEQ/ACK analysis]
    TCP payload (18 bytes)
Telnet
    Data: [00000EA64815DIDF]

No.     Time           Source                Destination           Protocol Length Info
     53 14.804866      192.168.4.1           192.168.4.2           TELNET   134    80 bytes data

Frame 53: 134 bytes on wire (1072 bits), 134 bytes captured (1072 bits)
Ethernet II, Src: c6:d8:d5:03:40:70 (c6:d8:d5:03:40:70), Dst: Intel_c0:00:30 (f4:26:79:c0:00:30)
    Destination: Intel_c0:00:30 (f4:26:79:c0:00:30)
        .... ..0. .... .... .... .... = LG bit: Globally unique address (factory default)
        .... ...0 .... .... .... .... = IG bit: Individual address (unicast)
    Source: c6:d8:d5:03:40:70 (c6:d8:d5:03:40:70)
        .... ..1. .... .... .... .... = LG bit: Locally administered address (this is NOT the factory default)
        .... ...0 .... .... .... .... = IG bit: Individual address (unicast)
    Type: IPv4 (0x0800)
    [Stream index: 0]
Internet Protocol Version 4, Src: 192.168.4.1, Dst: 192.168.4.2
Transmission Control Protocol, Src Port: 23, Dst Port: 20075, Seq: 19, Ack: 37, Len: 80
    Source Port: 23
    Destination Port: 20075
    [Stream index: 0]
    [Stream Packet Number: 8]
    [Conversation completeness: Incomplete, DATA (15)]
    [TCP Segment Len: 80]
    Sequence Number: 19    (relative sequence number)
    Sequence Number (raw): 7709
    [Next Sequence Number: 99    (relative sequence number)]
    Acknowledgment Number: 37    (relative ack number)
    Acknowledgment number (raw): 2008890334
    0101 .... = Header Length: 20 bytes (5)
    Flags: 0x018 (PSH, ACK)
    Window: 2108
    [Calculated window size: 2108]
    [Window size scaling factor: -2 (no window scaling used)]
    Checksum: 0x6764 [unverified]
    [Checksum Status: Unverified]
    Urgent Pointer: 0
    [Timestamps]
    [SEQ/ACK analysis]
    TCP payload (80 bytes)
Telnet
    Data: [00000EA64815DI00739   MSRT-10-14                      2.001.20010000101F40002D2

No.     Time           Source                Destination           Protocol Length Info
     55 14.856697      192.168.4.1           192.168.4.2           TELNET   76     22 bytes data

Frame 55: 76 bytes on wire (608 bits), 76 bytes captured (608 bits)
Ethernet II, Src: c6:d8:d5:03:40:70 (c6:d8:d5:03:40:70), Dst: Intel_c0:00:30 (f4:26:79:c0:00:30)
    Destination: Intel_c0:00:30 (f4:26:79:c0:00:30)
        .... ..0. .... .... .... .... = LG bit: Globally unique address (factory default)
        .... ...0 .... .... .... .... = IG bit: Individual address (unicast)
    Source: c6:d8:d5:03:40:70 (c6:d8:d5:03:40:70)
        .... ..1. .... .... .... .... = LG bit: Locally administered address (this is NOT the factory default)
        .... ...0 .... .... .... .... = IG bit: Individual address (unicast)
    Type: IPv4 (0x0800)
    [Stream index: 0]
Internet Protocol Version 4, Src: 192.168.4.1, Dst: 192.168.4.2
Transmission Control Protocol, Src Port: 23, Dst Port: 20075, Seq: 99, Ack: 37, Len: 22
    Source Port: 23
    Destination Port: 20075
    [Stream index: 0]
    [Stream Packet Number: 10]
    [Conversation completeness: Incomplete, DATA (15)]
    [TCP Segment Len: 22]
    Sequence Number: 99    (relative sequence number)
    Sequence Number (raw): 7789
    [Next Sequence Number: 121    (relative sequence number)]
    Acknowledgment Number: 37    (relative ack number)
    Acknowledgment number (raw): 2008890334
    0101 .... = Header Length: 20 bytes (5)
    Flags: 0x018 (PSH, ACK)
    Window: 2108
    [Calculated window size: 2108]
    [Window size scaling factor: -2 (no window scaling used)]
    Checksum: 0xbc22 [unverified]
    [Checksum Status: Unverified]
    Urgent Pointer: 0
    [Timestamps]
    [SEQ/ACK analysis]
    TCP payload (22 bytes)
Telnet
    Data: BCF000001F400000000A2]

No.     Time           Source                Destination           Protocol Length Info
     57 14.954372      192.168.4.2           192.168.4.1           TELNET   74     20 bytes data

Frame 57: 74 bytes on wire (592 bits), 74 bytes captured (592 bits)
Ethernet II, Src: Intel_c0:00:30 (f4:26:79:c0:00:30), Dst: c6:d8:d5:03:40:70 (c6:d8:d5:03:40:70)
    Destination: c6:d8:d5:03:40:70 (c6:d8:d5:03:40:70)
        .... ..1. .... .... .... .... = LG bit: Locally administered address (this is NOT the factory default)
        .... ...0 .... .... .... .... = IG bit: Individual address (unicast)
    Source: Intel_c0:00:30 (f4:26:79:c0:00:30)
        .... ..0. .... .... .... .... = LG bit: Globally unique address (factory default)
        .... ...0 .... .... .... .... = IG bit: Individual address (unicast)
    Type: IPv4 (0x0800)
    [Stream index: 0]
Internet Protocol Version 4, Src: 192.168.4.2, Dst: 192.168.4.1
Transmission Control Protocol, Src Port: 20075, Dst Port: 23, Seq: 37, Ack: 121, Len: 20
    Source Port: 20075
    Destination Port: 23
    [Stream index: 0]
    [Stream Packet Number: 12]
    [Conversation completeness: Incomplete, DATA (15)]
    [TCP Segment Len: 20]
    Sequence Number: 37    (relative sequence number)
    Sequence Number (raw): 2008890334
    [Next Sequence Number: 57    (relative sequence number)]
    Acknowledgment Number: 121    (relative ack number)
    Acknowledgment number (raw): 7811
    0101 .... = Header Length: 20 bytes (5)
    Flags: 0x018 (PSH, ACK)
    Window: 1928
    [Calculated window size: 1928]
    [Window size scaling factor: -2 (no window scaling used)]
    Checksum: 0xa3e8 [unverified]
    [Checksum Status: Unverified]
    Urgent Pointer: 0
    [Timestamps]
    [SEQ/ACK analysis]
    TCP payload (20 bytes)
Telnet
    Data: [00000EA64815ZO1036]

No.     Time           Source                Destination           Protocol Length Info
     58 14.965190      192.168.4.1           192.168.4.2           TELNET   88     34 bytes data

Frame 58: 88 bytes on wire (704 bits), 88 bytes captured (704 bits)
Ethernet II, Src: c6:d8:d5:03:40:70 (c6:d8:d5:03:40:70), Dst: Intel_c0:00:30 (f4:26:79:c0:00:30)
    Destination: Intel_c0:00:30 (f4:26:79:c0:00:30)
        .... ..0. .... .... .... .... = LG bit: Globally unique address (factory default)
        .... ...0 .... .... .... .... = IG bit: Individual address (unicast)
    Source: c6:d8:d5:03:40:70 (c6:d8:d5:03:40:70)
        .... ..1. .... .... .... .... = LG bit: Locally administered address (this is NOT the factory default)
        .... ...0 .... .... .... .... = IG bit: Individual address (unicast)
    Type: IPv4 (0x0800)
    [Stream index: 0]
Internet Protocol Version 4, Src: 192.168.4.1, Dst: 192.168.4.2
Transmission Control Protocol, Src Port: 23, Dst Port: 20075, Seq: 121, Ack: 57, Len: 34
    Source Port: 23
    Destination Port: 20075
    [Stream index: 0]
    [Stream Packet Number: 13]
    [Conversation completeness: Incomplete, DATA (15)]
    [TCP Segment Len: 34]
    Sequence Number: 121    (relative sequence number)
    Sequence Number (raw): 7811
    [Next Sequence Number: 155    (relative sequence number)]
    Acknowledgment Number: 57    (relative ack number)
    Acknowledgment number (raw): 2008890354
    0101 .... = Header Length: 20 bytes (5)
    Flags: 0x018 (PSH, ACK)
    Window: 2088
    [Calculated window size: 2088]
    [Window size scaling factor: -2 (no window scaling used)]
    Checksum: 0x26bf [unverified]
    [Checksum Status: Unverified]
    Urgent Pointer: 0
    [Timestamps]
    [SEQ/ACK analysis]
    TCP payload (34 bytes)
Telnet
    Data: [00000EA64815ZO0000DC58000000021D]

No.     Time           Source                Destination           Protocol Length Info
     60 15.065889      192.168.4.2           192.168.4.1           TELNET   74     20 bytes data

Frame 60: 74 bytes on wire (592 bits), 74 bytes captured (592 bits)
Ethernet II, Src: Intel_c0:00:30 (f4:26:79:c0:00:30), Dst: c6:d8:d5:03:40:70 (c6:d8:d5:03:40:70)
    Destination: c6:d8:d5:03:40:70 (c6:d8:d5:03:40:70)
        .... ..1. .... .... .... .... = LG bit: Locally administered address (this is NOT the factory default)
        .... ...0 .... .... .... .... = IG bit: Individual address (unicast)
    Source: Intel_c0:00:30 (f4:26:79:c0:00:30)
        .... ..0. .... .... .... .... = LG bit: Globally unique address (factory default)
        .... ...0 .... .... .... .... = IG bit: Individual address (unicast)
    Type: IPv4 (0x0800)
    [Stream index: 0]
Internet Protocol Version 4, Src: 192.168.4.2, Dst: 192.168.4.1
Transmission Control Protocol, Src Port: 20075, Dst Port: 23, Seq: 57, Ack: 155, Len: 20
    Source Port: 20075
    Destination Port: 23
    [Stream index: 0]
    [Stream Packet Number: 15]
    [Conversation completeness: Incomplete, DATA (15)]
    [TCP Segment Len: 20]
    Sequence Number: 57    (relative sequence number)
    Sequence Number (raw): 2008890354
    [Next Sequence Number: 77    (relative sequence number)]
    Acknowledgment Number: 155    (relative ack number)
    Acknowledgment number (raw): 7845
    0101 .... = Header Length: 20 bytes (5)
    Flags: 0x018 (PSH, ACK)
    Window: 1894
    [Calculated window size: 1894]
    [Window size scaling factor: -2 (no window scaling used)]
    Checksum: 0xa2cf [unverified]
    [Checksum Status: Unverified]
    Urgent Pointer: 0
    [Timestamps]
    [SEQ/ACK analysis]
    TCP payload (20 bytes)
Telnet
    Data: [00000EA64815ZO0196]

No.     Time           Source                Destination           Protocol Length Info
     61 15.072096      192.168.4.1           192.168.4.2           TELNET   88     34 bytes data

Frame 61: 88 bytes on wire (704 bits), 88 bytes captured (704 bits)
Ethernet II, Src: c6:d8:d5:03:40:70 (c6:d8:d5:03:40:70), Dst: Intel_c0:00:30 (f4:26:79:c0:00:30)
    Destination: Intel_c0:00:30 (f4:26:79:c0:00:30)
        .... ..0. .... .... .... .... = LG bit: Globally unique address (factory default)
        .... ...0 .... .... .... .... = IG bit: Individual address (unicast)
    Source: c6:d8:d5:03:40:70 (c6:d8:d5:03:40:70)
        .... ..1. .... .... .... .... = LG bit: Locally administered address (this is NOT the factory default)
        .... ...0 .... .... .... .... = IG bit: Individual address (unicast)
    Type: IPv4 (0x0800)
    [Stream index: 0]
Internet Protocol Version 4, Src: 192.168.4.1, Dst: 192.168.4.2
Transmission Control Protocol, Src Port: 23, Dst Port: 20075, Seq: 155, Ack: 77, Len: 34
    Source Port: 23
    Destination Port: 20075
    [Stream index: 0]
    [Stream Packet Number: 16]
    [Conversation completeness: Incomplete, DATA (15)]
    [TCP Segment Len: 34]
    Sequence Number: 155    (relative sequence number)
    Sequence Number (raw): 7845
    [Next Sequence Number: 189    (relative sequence number)]
    Acknowledgment Number: 77    (relative ack number)
    Acknowledgment number (raw): 2008890374
    0101 .... = Header Length: 20 bytes (5)
    Flags: 0x018 (PSH, ACK)
    Window: 2068
    [Calculated window size: 2068]
    [Window size scaling factor: -2 (no window scaling used)]
    Checksum: 0x3599 [unverified]
    [Checksum Status: Unverified]
    Urgent Pointer: 0
    [Timestamps]
    [SEQ/ACK analysis]
    TCP payload (34 bytes)
Telnet
    Data: [00000EA64815ZO0000DC580000000057]

No.     Time           Source                Destination           Protocol Length Info
     63 15.185850      192.168.4.2           192.168.4.1           TELNET   72     18 bytes data

Frame 63: 72 bytes on wire (576 bits), 72 bytes captured (576 bits)
Ethernet II, Src: Intel_c0:00:30 (f4:26:79:c0:00:30), Dst: c6:d8:d5:03:40:70 (c6:d8:d5:03:40:70)
    Destination: c6:d8:d5:03:40:70 (c6:d8:d5:03:40:70)
        .... ..1. .... .... .... .... = LG bit: Locally administered address (this is NOT the factory default)
        .... ...0 .... .... .... .... = IG bit: Individual address (unicast)
    Source: Intel_c0:00:30 (f4:26:79:c0:00:30)
        .... ..0. .... .... .... .... = LG bit: Globally unique address (factory default)
        .... ...0 .... .... .... .... = IG bit: Individual address (unicast)
    Type: IPv4 (0x0800)
    [Stream index: 0]
Internet Protocol Version 4, Src: 192.168.4.2, Dst: 192.168.4.1
Transmission Control Protocol, Src Port: 20075, Dst Port: 23, Seq: 77, Ack: 189, Len: 18
    Source Port: 20075
    Destination Port: 23
    [Stream index: 0]
    [Stream Packet Number: 18]
    [Conversation completeness: Incomplete, DATA (15)]
    [TCP Segment Len: 18]
    Sequence Number: 77    (relative sequence number)
    Sequence Number (raw): 2008890374
    [Next Sequence Number: 95    (relative sequence number)]
    Acknowledgment Number: 189    (relative ack number)
    Acknowledgment number (raw): 7879
    0101 .... = Header Length: 20 bytes (5)
    Flags: 0x018 (PSH, ACK)
    Window: 1860
    [Calculated window size: 1860]
    [Window size scaling factor: -2 (no window scaling used)]
    Checksum: 0xe1ec [unverified]
    [Checksum Status: Unverified]
    Urgent Pointer: 0
    [Timestamps]
    [SEQ/ACK analysis]
    TCP payload (18 bytes)
Telnet
    Data: [00000EA64815RCB4]

No.     Time           Source                Destination           Protocol Length Info
     64 15.198932      192.168.4.1           192.168.4.2           TELNET   112    58 bytes data

Frame 64: 112 bytes on wire (896 bits), 112 bytes captured (896 bits)
Ethernet II, Src: c6:d8:d5:03:40:70 (c6:d8:d5:03:40:70), Dst: Intel_c0:00:30 (f4:26:79:c0:00:30)
    Destination: Intel_c0:00:30 (f4:26:79:c0:00:30)
        .... ..0. .... .... .... .... = LG bit: Globally unique address (factory default)
        .... ...0 .... .... .... .... = IG bit: Individual address (unicast)
    Source: c6:d8:d5:03:40:70 (c6:d8:d5:03:40:70)
        .... ..1. .... .... .... .... = LG bit: Locally administered address (this is NOT the factory default)
        .... ...0 .... .... .... .... = IG bit: Individual address (unicast)
    Type: IPv4 (0x0800)
    [Stream index: 0]
Internet Protocol Version 4, Src: 192.168.4.1, Dst: 192.168.4.2
Transmission Control Protocol, Src Port: 23, Dst Port: 20075, Seq: 189, Ack: 95, Len: 58
    Source Port: 23
    Destination Port: 20075
    [Stream index: 0]
    [Stream Packet Number: 19]
    [Conversation completeness: Incomplete, DATA (15)]
    [TCP Segment Len: 58]
    Sequence Number: 189    (relative sequence number)
    Sequence Number (raw): 7879
    [Next Sequence Number: 247    (relative sequence number)]
    Acknowledgment Number: 95    (relative ack number)
    Acknowledgment number (raw): 2008890392
    0101 .... = Header Length: 20 bytes (5)
    Flags: 0x018 (PSH, ACK)
    Window: 2050
    [Calculated window size: 2050]
    [Window size scaling factor: -2 (no window scaling used)]
    Checksum: 0x072d [unverified]
    [Checksum Status: Unverified]
    Urgent Pointer: 0
    [Timestamps]
    [SEQ/ACK analysis]
    TCP payload (58 bytes)
Telnet
    Data: [00000EA64815RC0000005900000000000000000000000000000000AA]

No.     Time           Source                Destination           Protocol Length Info
     66 15.746909      192.168.4.2           192.168.4.1           TELNET   72     18 bytes data

Frame 66: 72 bytes on wire (576 bits), 72 bytes captured (576 bits)
Ethernet II, Src: Intel_c0:00:30 (f4:26:79:c0:00:30), Dst: c6:d8:d5:03:40:70 (c6:d8:d5:03:40:70)
    Destination: c6:d8:d5:03:40:70 (c6:d8:d5:03:40:70)
        .... ..1. .... .... .... .... = LG bit: Locally administered address (this is NOT the factory default)
        .... ...0 .... .... .... .... = IG bit: Individual address (unicast)
    Source: Intel_c0:00:30 (f4:26:79:c0:00:30)
        .... ..0. .... .... .... .... = LG bit: Globally unique address (factory default)
        .... ...0 .... .... .... .... = IG bit: Individual address (unicast)
    Type: IPv4 (0x0800)
    [Stream index: 0]
Internet Protocol Version 4, Src: 192.168.4.2, Dst: 192.168.4.1
Transmission Control Protocol, Src Port: 20075, Dst Port: 23, Seq: 95, Ack: 247, Len: 18
    Source Port: 20075
    Destination Port: 23
    [Stream index: 0]
    [Stream Packet Number: 21]
    [Conversation completeness: Incomplete, DATA (15)]
    [TCP Segment Len: 18]
    Sequence Number: 95    (relative sequence number)
    Sequence Number (raw): 2008890392
    [Next Sequence Number: 113    (relative sequence number)]
    Acknowledgment Number: 247    (relative ack number)
    Acknowledgment number (raw): 7937
    0101 .... = Header Length: 20 bytes (5)
    Flags: 0x018 (PSH, ACK)
    Window: 1802
    [Calculated window size: 1802]
    [Window size scaling factor: -2 (no window scaling used)]
    Checksum: 0xd3f2 [unverified]
    [Checksum Status: Unverified]
    Urgent Pointer: 0
    [Timestamps]
    [SEQ/ACK analysis]
    TCP payload (18 bytes)
Telnet
    Data: [00000EA64815DS82]

No.     Time           Source                Destination           Protocol Length Info
     67 15.762113      192.168.4.1           192.168.4.2           TELNET   118    64 bytes data

Frame 67: 118 bytes on wire (944 bits), 118 bytes captured (944 bits)
Ethernet II, Src: c6:d8:d5:03:40:70 (c6:d8:d5:03:40:70), Dst: Intel_c0:00:30 (f4:26:79:c0:00:30)
    Destination: Intel_c0:00:30 (f4:26:79:c0:00:30)
        .... ..0. .... .... .... .... = LG bit: Globally unique address (factory default)
        .... ...0 .... .... .... .... = IG bit: Individual address (unicast)
    Source: c6:d8:d5:03:40:70 (c6:d8:d5:03:40:70)
        .... ..1. .... .... .... .... = LG bit: Locally administered address (this is NOT the factory default)
        .... ...0 .... .... .... .... = IG bit: Individual address (unicast)
    Type: IPv4 (0x0800)
    [Stream index: 0]
Internet Protocol Version 4, Src: 192.168.4.1, Dst: 192.168.4.2
Transmission Control Protocol, Src Port: 23, Dst Port: 20075, Seq: 247, Ack: 113, Len: 64
    Source Port: 23
    Destination Port: 20075
    [Stream index: 0]
    [Stream Packet Number: 22]
    [Conversation completeness: Incomplete, DATA (15)]
    [TCP Segment Len: 64]
    Sequence Number: 247    (relative sequence number)
    Sequence Number (raw): 7937
    [Next Sequence Number: 311    (relative sequence number)]
    Acknowledgment Number: 113    (relative ack number)
    Acknowledgment number (raw): 2008890410
    0101 .... = Header Length: 20 bytes (5)
    Flags: 0x018 (PSH, ACK)
    Window: 2032
    [Calculated window size: 2032]
    [Window size scaling factor: -2 (no window scaling used)]
    Checksum: 0x0df6 [unverified]
    [Checksum Status: Unverified]
    Urgent Pointer: 0
    [Timestamps]
    [SEQ/ACK analysis]
    TCP payload (64 bytes)
Telnet
    Data: [00000EA64815DSB800748101010401010DE403E80003000000ED0000DC58A8]

No.     Time           Source                Destination           Protocol Length Info
     70 17.124509      192.168.4.2           192.168.4.1           TELNET   72     18 bytes data

Frame 70: 72 bytes on wire (576 bits), 72 bytes captured (576 bits)
Ethernet II, Src: Intel_c0:00:30 (f4:26:79:c0:00:30), Dst: c6:d8:d5:03:40:70 (c6:d8:d5:03:40:70)
    Destination: c6:d8:d5:03:40:70 (c6:d8:d5:03:40:70)
        .... ..1. .... .... .... .... = LG bit: Locally administered address (this is NOT the factory default)
        .... ...0 .... .... .... .... = IG bit: Individual address (unicast)
    Source: Intel_c0:00:30 (f4:26:79:c0:00:30)
        .... ..0. .... .... .... .... = LG bit: Globally unique address (factory default)
        .... ...0 .... .... .... .... = IG bit: Individual address (unicast)
    Type: IPv4 (0x0800)
    [Stream index: 0]
Internet Protocol Version 4, Src: 192.168.4.2, Dst: 192.168.4.1
Transmission Control Protocol, Src Port: 20075, Dst Port: 23, Seq: 113, Ack: 311, Len: 18
    Source Port: 20075
    Destination Port: 23
    [Stream index: 0]
    [Stream Packet Number: 24]
    [Conversation completeness: Incomplete, DATA (15)]
    [TCP Segment Len: 18]
    Sequence Number: 113    (relative sequence number)
    Sequence Number (raw): 2008890410
    [Next Sequence Number: 131    (relative sequence number)]
    Acknowledgment Number: 311    (relative ack number)
    Acknowledgment number (raw): 8001
    0101 .... = Header Length: 20 bytes (5)
    Flags: 0x018 (PSH, ACK)
    Window: 1738
    [Calculated window size: 1738]
    [Window size scaling factor: -2 (no window scaling used)]
    Checksum: 0xd3e0 [unverified]
    [Checksum Status: Unverified]
    Urgent Pointer: 0
    [Timestamps]
    [SEQ/ACK analysis]
    TCP payload (18 bytes)
Telnet
    Data: [00000EA64815DS82]

No.     Time           Source                Destination           Protocol Length Info
     71 17.133615      192.168.4.1           192.168.4.2           TELNET   118    64 bytes data

Frame 71: 118 bytes on wire (944 bits), 118 bytes captured (944 bits)
Ethernet II, Src: c6:d8:d5:03:40:70 (c6:d8:d5:03:40:70), Dst: Intel_c0:00:30 (f4:26:79:c0:00:30)
    Destination: Intel_c0:00:30 (f4:26:79:c0:00:30)
        .... ..0. .... .... .... .... = LG bit: Globally unique address (factory default)
        .... ...0 .... .... .... .... = IG bit: Individual address (unicast)
    Source: c6:d8:d5:03:40:70 (c6:d8:d5:03:40:70)
        .... ..1. .... .... .... .... = LG bit: Locally administered address (this is NOT the factory default)
        .... ...0 .... .... .... .... = IG bit: Individual address (unicast)
    Type: IPv4 (0x0800)
    [Stream index: 0]
Internet Protocol Version 4, Src: 192.168.4.1, Dst: 192.168.4.2
Transmission Control Protocol, Src Port: 23, Dst Port: 20075, Seq: 311, Ack: 131, Len: 64
    Source Port: 23
    Destination Port: 20075
    [Stream index: 0]
    [Stream Packet Number: 25]
    [Conversation completeness: Incomplete, DATA (15)]
    [TCP Segment Len: 64]
    Sequence Number: 311    (relative sequence number)
    Sequence Number (raw): 8001
    [Next Sequence Number: 375    (relative sequence number)]
    Acknowledgment Number: 131    (relative ack number)
    Acknowledgment number (raw): 2008890428
    0101 .... = Header Length: 20 bytes (5)
    Flags: 0x018 (PSH, ACK)
    Window: 2014
    [Calculated window size: 2014]
    [Window size scaling factor: -2 (no window scaling used)]
    Checksum: 0x11c1 [unverified]
    [Checksum Status: Unverified]
    Urgent Pointer: 0
    [Timestamps]
    [SEQ/ACK analysis]
    TCP payload (64 bytes)
Telnet
    Data: [00000EA64815DSB800748101010401010DE403E80003000000EE0000DC5863]

No.     Time           Source                Destination           Protocol Length Info
     73 18.450832      192.168.4.2           192.168.4.1           TELNET   72     18 bytes data

Frame 73: 72 bytes on wire (576 bits), 72 bytes captured (576 bits)
Ethernet II, Src: Intel_c0:00:30 (f4:26:79:c0:00:30), Dst: c6:d8:d5:03:40:70 (c6:d8:d5:03:40:70)
    Destination: c6:d8:d5:03:40:70 (c6:d8:d5:03:40:70)
        .... ..1. .... .... .... .... = LG bit: Locally administered address (this is NOT the factory default)
        .... ...0 .... .... .... .... = IG bit: Individual address (unicast)
    Source: Intel_c0:00:30 (f4:26:79:c0:00:30)
        .... ..0. .... .... .... .... = LG bit: Globally unique address (factory default)
        .... ...0 .... .... .... .... = IG bit: Individual address (unicast)
    Type: IPv4 (0x0800)
    [Stream index: 0]
Internet Protocol Version 4, Src: 192.168.4.2, Dst: 192.168.4.1
Transmission Control Protocol, Src Port: 20075, Dst Port: 23, Seq: 131, Ack: 375, Len: 18
    Source Port: 20075
    Destination Port: 23
    [Stream index: 0]
    [Stream Packet Number: 27]
    [Conversation completeness: Incomplete, DATA (15)]
    [TCP Segment Len: 18]
    Sequence Number: 131    (relative sequence number)
    Sequence Number (raw): 2008890428
    [Next Sequence Number: 149    (relative sequence number)]
    Acknowledgment Number: 375    (relative ack number)
    Acknowledgment number (raw): 8065
    0101 .... = Header Length: 20 bytes (5)
    Flags: 0x018 (PSH, ACK)
    Window: 1674
    [Calculated window size: 1674]
    [Window size scaling factor: -2 (no window scaling used)]
    Checksum: 0xd3ce [unverified]
    [Checksum Status: Unverified]
    Urgent Pointer: 0
    [Timestamps]
    [SEQ/ACK analysis]
    TCP payload (18 bytes)
Telnet
    Data: [00000EA64815DS82]

No.     Time           Source                Destination           Protocol Length Info
     74 18.462480      192.168.4.1           192.168.4.2           TELNET   118    64 bytes data

Frame 74: 118 bytes on wire (944 bits), 118 bytes captured (944 bits)
Ethernet II, Src: c6:d8:d5:03:40:70 (c6:d8:d5:03:40:70), Dst: Intel_c0:00:30 (f4:26:79:c0:00:30)
    Destination: Intel_c0:00:30 (f4:26:79:c0:00:30)
        .... ..0. .... .... .... .... = LG bit: Globally unique address (factory default)
        .... ...0 .... .... .... .... = IG bit: Individual address (unicast)
    Source: c6:d8:d5:03:40:70 (c6:d8:d5:03:40:70)
        .... ..1. .... .... .... .... = LG bit: Locally administered address (this is NOT the factory default)
        .... ...0 .... .... .... .... = IG bit: Individual address (unicast)
    Type: IPv4 (0x0800)
    [Stream index: 0]
Internet Protocol Version 4, Src: 192.168.4.1, Dst: 192.168.4.2
Transmission Control Protocol, Src Port: 23, Dst Port: 20075, Seq: 375, Ack: 149, Len: 64
    Source Port: 23
    Destination Port: 20075
    [Stream index: 0]
    [Stream Packet Number: 28]
    [Conversation completeness: Incomplete, DATA (15)]
    [TCP Segment Len: 64]
    Sequence Number: 375    (relative sequence number)
    Sequence Number (raw): 8065
    [Next Sequence Number: 439    (relative sequence number)]
    Acknowledgment Number: 149    (relative ack number)
    Acknowledgment number (raw): 2008890446
    0101 .... = Header Length: 20 bytes (5)
    Flags: 0x018 (PSH, ACK)
    Window: 1996
    [Calculated window size: 1996]
    [Window size scaling factor: -2 (no window scaling used)]
    Checksum: 0x0186 [unverified]
    [Checksum Status: Unverified]
    Urgent Pointer: 0
    [Timestamps]
    [SEQ/ACK analysis]
    TCP payload (64 bytes)
Telnet
    Data: [00000EA64815DSB800748101010401010DE403E80003000000EF0000DC581B]

No.     Time           Source                Destination           Protocol Length Info
     76 19.810944      192.168.4.2           192.168.4.1           TELNET   72     18 bytes data

Frame 76: 72 bytes on wire (576 bits), 72 bytes captured (576 bits)
Ethernet II, Src: Intel_c0:00:30 (f4:26:79:c0:00:30), Dst: c6:d8:d5:03:40:70 (c6:d8:d5:03:40:70)
    Destination: c6:d8:d5:03:40:70 (c6:d8:d5:03:40:70)
        .... ..1. .... .... .... .... = LG bit: Locally administered address (this is NOT the factory default)
        .... ...0 .... .... .... .... = IG bit: Individual address (unicast)
    Source: Intel_c0:00:30 (f4:26:79:c0:00:30)
        .... ..0. .... .... .... .... = LG bit: Globally unique address (factory default)
        .... ...0 .... .... .... .... = IG bit: Individual address (unicast)
    Type: IPv4 (0x0800)
    [Stream index: 0]
Internet Protocol Version 4, Src: 192.168.4.2, Dst: 192.168.4.1
Transmission Control Protocol, Src Port: 20075, Dst Port: 23, Seq: 149, Ack: 439, Len: 18
    Source Port: 20075
    Destination Port: 23
    [Stream index: 0]
    [Stream Packet Number: 30]
    [Conversation completeness: Incomplete, DATA (15)]
    [TCP Segment Len: 18]
    Sequence Number: 149    (relative sequence number)
    Sequence Number (raw): 2008890446
    [Next Sequence Number: 167    (relative sequence number)]
    Acknowledgment Number: 439    (relative ack number)
    Acknowledgment number (raw): 8129
    0101 .... = Header Length: 20 bytes (5)
    Flags: 0x018 (PSH, ACK)
    Window: 1610
    [Calculated window size: 1610]
    [Window size scaling factor: -2 (no window scaling used)]
    Checksum: 0xd3bc [unverified]
    [Checksum Status: Unverified]
    Urgent Pointer: 0
    [Timestamps]
    [SEQ/ACK analysis]
    TCP payload (18 bytes)
Telnet
    Data: [00000EA64815DS82]

No.     Time           Source                Destination           Protocol Length Info
     77 19.831215      192.168.4.1           192.168.4.2           TELNET   118    64 bytes data

Frame 77: 118 bytes on wire (944 bits), 118 bytes captured (944 bits)
Ethernet II, Src: c6:d8:d5:03:40:70 (c6:d8:d5:03:40:70), Dst: Intel_c0:00:30 (f4:26:79:c0:00:30)
    Destination: Intel_c0:00:30 (f4:26:79:c0:00:30)
        .... ..0. .... .... .... .... = LG bit: Globally unique address (factory default)
        .... ...0 .... .... .... .... = IG bit: Individual address (unicast)
    Source: c6:d8:d5:03:40:70 (c6:d8:d5:03:40:70)
        .... ..1. .... .... .... .... = LG bit: Locally administered address (this is NOT the factory default)
        .... ...0 .... .... .... .... = IG bit: Individual address (unicast)
    Type: IPv4 (0x0800)
    [Stream index: 0]
Internet Protocol Version 4, Src: 192.168.4.1, Dst: 192.168.4.2
Transmission Control Protocol, Src Port: 23, Dst Port: 20075, Seq: 439, Ack: 167, Len: 64
    Source Port: 23
    Destination Port: 20075
    [Stream index: 0]
    [Stream Packet Number: 31]
    [Conversation completeness: Incomplete, DATA (15)]
    [TCP Segment Len: 64]
    Sequence Number: 439    (relative sequence number)
    Sequence Number (raw): 8129
    [Next Sequence Number: 503    (relative sequence number)]
    Acknowledgment Number: 167    (relative ack number)
    Acknowledgment number (raw): 2008890464
    0101 .... = Header Length: 20 bytes (5)
    Flags: 0x018 (PSH, ACK)
    Window: 1978
    [Calculated window size: 1978]
    [Window size scaling factor: -2 (no window scaling used)]
    Checksum: 0x2434 [unverified]
    [Checksum Status: Unverified]
    Urgent Pointer: 0
    [Timestamps]
    [SEQ/ACK analysis]
    TCP payload (64 bytes)
Telnet
    Data: [00000EA64815DSB800748101010401010DE403E80003000000F10000DC58B4]

No.     Time           Source                Destination           Protocol Length Info
     79 21.126381      192.168.4.2           192.168.4.1           TELNET   72     18 bytes data

Frame 79: 72 bytes on wire (576 bits), 72 bytes captured (576 bits)
Ethernet II, Src: Intel_c0:00:30 (f4:26:79:c0:00:30), Dst: c6:d8:d5:03:40:70 (c6:d8:d5:03:40:70)
    Destination: c6:d8:d5:03:40:70 (c6:d8:d5:03:40:70)
        .... ..1. .... .... .... .... = LG bit: Locally administered address (this is NOT the factory default)
        .... ...0 .... .... .... .... = IG bit: Individual address (unicast)
    Source: Intel_c0:00:30 (f4:26:79:c0:00:30)
        .... ..0. .... .... .... .... = LG bit: Globally unique address (factory default)
        .... ...0 .... .... .... .... = IG bit: Individual address (unicast)
    Type: IPv4 (0x0800)
    [Stream index: 0]
Internet Protocol Version 4, Src: 192.168.4.2, Dst: 192.168.4.1
Transmission Control Protocol, Src Port: 20075, Dst Port: 23, Seq: 167, Ack: 503, Len: 18
    Source Port: 20075
    Destination Port: 23
    [Stream index: 0]
    [Stream Packet Number: 33]
    [Conversation completeness: Incomplete, DATA (15)]
    [TCP Segment Len: 18]
    Sequence Number: 167    (relative sequence number)
    Sequence Number (raw): 2008890464
    [Next Sequence Number: 185    (relative sequence number)]
    Acknowledgment Number: 503    (relative ack number)
    Acknowledgment number (raw): 8193
    0101 .... = Header Length: 20 bytes (5)
    Flags: 0x018 (PSH, ACK)
    Window: 1546
    [Calculated window size: 1546]
    [Window size scaling factor: -2 (no window scaling used)]
    Checksum: 0xd3aa [unverified]
    [Checksum Status: Unverified]
    Urgent Pointer: 0
    [Timestamps]
    [SEQ/ACK analysis]
    TCP payload (18 bytes)
Telnet
    Data: [00000EA64815DS82]

No.     Time           Source                Destination           Protocol Length Info
     80 21.135453      192.168.4.1           192.168.4.2           TELNET   118    64 bytes data

Frame 80: 118 bytes on wire (944 bits), 118 bytes captured (944 bits)
Ethernet II, Src: c6:d8:d5:03:40:70 (c6:d8:d5:03:40:70), Dst: Intel_c0:00:30 (f4:26:79:c0:00:30)
    Destination: Intel_c0:00:30 (f4:26:79:c0:00:30)
        .... ..0. .... .... .... .... = LG bit: Globally unique address (factory default)
        .... ...0 .... .... .... .... = IG bit: Individual address (unicast)
    Source: c6:d8:d5:03:40:70 (c6:d8:d5:03:40:70)
        .... ..1. .... .... .... .... = LG bit: Locally administered address (this is NOT the factory default)
        .... ...0 .... .... .... .... = IG bit: Individual address (unicast)
    Type: IPv4 (0x0800)
    [Stream index: 0]
Internet Protocol Version 4, Src: 192.168.4.1, Dst: 192.168.4.2
Transmission Control Protocol, Src Port: 23, Dst Port: 20075, Seq: 503, Ack: 185, Len: 64
    Source Port: 23
    Destination Port: 20075
    [Stream index: 0]
    [Stream Packet Number: 34]
    [Conversation completeness: Incomplete, DATA (15)]
    [TCP Segment Len: 64]
    Sequence Number: 503    (relative sequence number)
    Sequence Number (raw): 8193
    [Next Sequence Number: 567    (relative sequence number)]
    Acknowledgment Number: 185    (relative ack number)
    Acknowledgment number (raw): 2008890482
    0101 .... = Header Length: 20 bytes (5)
    Flags: 0x018 (PSH, ACK)
    Window: 1960
    [Calculated window size: 1960]
    [Window size scaling factor: -2 (no window scaling used)]
    Checksum: 0x13f3 [unverified]
    [Checksum Status: Unverified]
    Urgent Pointer: 0
    [Timestamps]
    [SEQ/ACK analysis]
    TCP payload (64 bytes)
Telnet
    Data: [00000EA64815DSB800748101010401010DE403E80003000000F20000DC58CC]

No.     Time           Source                Destination           Protocol Length Info
     82 22.473341      192.168.4.2           192.168.4.1           TELNET   72     18 bytes data

Frame 82: 72 bytes on wire (576 bits), 72 bytes captured (576 bits)
Ethernet II, Src: Intel_c0:00:30 (f4:26:79:c0:00:30), Dst: c6:d8:d5:03:40:70 (c6:d8:d5:03:40:70)
    Destination: c6:d8:d5:03:40:70 (c6:d8:d5:03:40:70)
        .... ..1. .... .... .... .... = LG bit: Locally administered address (this is NOT the factory default)
        .... ...0 .... .... .... .... = IG bit: Individual address (unicast)
    Source: Intel_c0:00:30 (f4:26:79:c0:00:30)
        .... ..0. .... .... .... .... = LG bit: Globally unique address (factory default)
        .... ...0 .... .... .... .... = IG bit: Individual address (unicast)
    Type: IPv4 (0x0800)
    [Stream index: 0]
Internet Protocol Version 4, Src: 192.168.4.2, Dst: 192.168.4.1
Transmission Control Protocol, Src Port: 20075, Dst Port: 23, Seq: 185, Ack: 567, Len: 18
    Source Port: 20075
    Destination Port: 23
    [Stream index: 0]
    [Stream Packet Number: 36]
    [Conversation completeness: Incomplete, DATA (15)]
    [TCP Segment Len: 18]
    Sequence Number: 185    (relative sequence number)
    Sequence Number (raw): 2008890482
    [Next Sequence Number: 203    (relative sequence number)]
    Acknowledgment Number: 567    (relative ack number)
    Acknowledgment number (raw): 8257
